hazard_id,hazard_description,hazard_category,harm,severity,probability_before,risk_level_before,risk_control,probability_after,risk_level_after,imdrf_code,medical_device_problem,expected_rate,max_expected_rate
H-001,Device breakage during use leading to fragment retention,Mechanical Failure,Minor Injury,Minor,Occasional,Medium,Material specification tightened; incoming inspection added; IFU updated with handling instructions,Remote,Low,A0301,Device breakage or deterioration,0.0005,0.001
H-002,Contamination due to packaging breach,Sterility / Biocontamination,Infection,Serious,Remote,Medium,100% seal integrity testing; validated packaging process; shelf-life testing,Improbable,Low,A0504,Packaging problem,0.0002,0.0005
H-003,Labeling error causing incorrect device selection,Use Error / Information,Incorrect device used,Moderate,Occasional,Medium,Design verification of all label variants; barcode cross-check system,Remote,Low,A1005,Labeling problem,0.0003,0.0006
H-004,Device malfunction during critical procedure step,Functional Failure,Procedure delay,Minor,Remote,Low,Functional testing per lot; validated manufacturing process,Improbable,Low,A0601,Failure to function at intended time,0.0001,0.0003
H-005,Difficulty inserting device due to dimensional variation,Ergonomic / Design,Tissue irritation,Minor,Occasional,Medium,Statistical process control on critical dimensions; design validation,Remote,Low,A0701,Difficulty using the device,0.0004,0.0008
H-006,Allergic reaction to device material,Biocompatibility,Allergic reaction,Moderate,Improbable,Low,Biocompatibility testing per ISO 10993; material certificates verified,Improbable,Low,A1301,Allergic reaction to device material,0.00005,0.0001
H-007,Component separation during procedure,Mechanical Failure,Foreign body retention,Serious,Remote,Medium,Joint strength testing; process validation; design FMEA review,Improbable,Low,A0306,Component separation,0.0001,0.0003
H-008,Electrical leakage exceeding limit,Electrical Safety,Electric shock,Critical,Remote,Medium,Hipot testing 100%; IEC 60601-1 compliance; periodic calibration,Improbable,Low,A0207,Electrical leakage problem,0.00001,0.00005
